[
  {
    "id": "001",
    "name": "GPT-6 Astra",
    "slug": "gpt-6-astra",
    "url": "https://openai.com/index/gpt-6-astra/",
    "category": "Particles",
    "technologies": [
      "WebGL",
      "Particles"
    ],
    "interactions": [
      "Mouse",
      "Scroll"
    ],
    "hasSound": false,
    "mobileFriendly": true,
    "aiAssisted": true,
    "status": "published",
    "description": {
      "en": "A draggable particle galaxy paired with an expansive scroll-driven launch story.",
      "zh": "可拖拽旋转的粒子星系与长篇滚动发布叙事。"
    }
  },
  {
    "id": "002",
    "name": "Bruno Simon",
    "slug": "bruno-simon",
    "url": "https://bruno-simon.com/",
    "category": "Game",
    "technologies": [
      "Three.js",
      "Physics"
    ],
    "interactions": [
      "Keyboard"
    ],
    "hasSound": true,
    "mobileFriendly": true,
    "aiAssisted": false,
    "status": "published",
    "description": {
      "en": "Drive a tiny car through a complete 3D world to discover every project.",
      "zh": "驾驶一辆玩具车，在完整的三维世界中探索作品。"
    }
  },
  {
    "id": "003",
    "name": "Lusion",
    "slug": "lusion",
    "url": "https://lusion.co/",
    "category": "3D World",
    "technologies": [
      "WebGL",
      "GLSL"
    ],
    "interactions": [
      "Mouse",
      "Scroll"
    ],
    "hasSound": true,
    "mobileFriendly": true,
    "aiAssisted": false,
    "status": "published",
    "description": {
      "en": "Cinematic real-time 3D, fluid simulation and seamless spatial transitions.",
      "zh": "电影质感的实时三维、流体模拟与空间转场。"
    }
  },
  {
    "id": "004",
    "name": "Active Theory",
    "slug": "active-theory",
    "url": "https://activetheory.net/",
    "category": "3D World",
    "technologies": [
      "WebGL",
      "GLSL"
    ],
    "interactions": [
      "Mouse",
      "Sound"
    ],
    "hasSound": true,
    "mobileFriendly": true,
    "aiAssisted": false,
    "status": "published",
    "description": {
      "en": "Game-engine quality environments shaped by movement, story and sound.",
      "zh": "接近游戏引擎质感的沉浸空间和声音体验。"
    }
  },
  {
    "id": "005",
    "name": "Resn",
    "slug": "resn",
    "url": "https://resn.co.nz/",
    "category": "Experimental",
    "technologies": [
      "WebGL",
      "Canvas"
    ],
    "interactions": [
      "Mouse",
      "Sound"
    ],
    "hasSound": true,
    "mobileFriendly": true,
    "aiAssisted": false,
    "status": "published",
    "description": {
      "en": "A strange, unpredictable playground that reacts dramatically to the pointer.",
      "zh": "怪诞、不可预测，页面会对鼠标做出夸张反馈。"
    }
  },
  {
    "id": "006",
    "name": "Immersive Garden",
    "slug": "immersive-garden",
    "url": "https://immersive-g.com/",
    "category": "3D World",
    "technologies": [
      "Three.js",
      "GLSL"
    ],
    "interactions": [
      "Mouse",
      "Scroll"
    ],
    "hasSound": true,
    "mobileFriendly": true,
    "aiAssisted": false,
    "status": "published",
    "description": {
      "en": "Dreamlike digital gardens, organic materials and spatial camera movement.",
      "zh": "梦境般的数字花园、自然材质和空间镜头。"
    }
  },
  {
    "id": "007",
    "name": "Dogstudio",
    "slug": "dogstudio",
    "url": "https://dogstudio.co/",
    "category": "3D World",
    "technologies": [
      "WebGL",
      "GSAP"
    ],
    "interactions": [
      "Scroll"
    ],
    "hasSound": true,
    "mobileFriendly": true,
    "aiAssisted": false,
    "status": "published",
    "description": {
      "en": "Characters, environments and camera work combined into cinematic web stories.",
      "zh": "角色、场景和镜头共同组成电影式网页体验。"
    }
  },
  {
    "id": "008",
    "name": "Basement Studio",
    "slug": "basement-studio",
    "url": "https://basement.studio/",
    "category": "Scroll",
    "technologies": [
      "R3F",
      "Physics"
    ],
    "interactions": [
      "Scroll",
      "Mouse"
    ],
    "hasSound": false,
    "mobileFriendly": true,
    "aiAssisted": false,
    "status": "published",
    "description": {
      "en": "Flat project cards gain convincing depth, weight and physical momentum.",
      "zh": "平面卡片像真实物体一样具有空间和物理惯性。"
    }
  },
  {
    "id": "009",
    "name": "Unseen Studio",
    "slug": "unseen-studio",
    "url": "https://unseen.co/",
    "category": "Experimental",
    "technologies": [
      "WebGL",
      "GLSL"
    ],
    "interactions": [
      "Mouse",
      "Scroll"
    ],
    "hasSound": false,
    "mobileFriendly": true,
    "aiAssisted": false,
    "status": "published",
    "description": {
      "en": "Soft deformation, glossy materials and restrained futuristic direction.",
      "zh": "柔软形变、光泽材质与克制的未来主义设计。"
    }
  },
  {
    "id": "010",
    "name": "Garden Eight",
    "slug": "garden-eight",
    "url": "https://garden-eight.com/",
    "category": "Scroll",
    "technologies": [
      "WebGL",
      "GSAP"
    ],
    "interactions": [
      "Mouse",
      "Scroll"
    ],
    "hasSound": false,
    "mobileFriendly": true,
    "aiAssisted": false,
    "status": "published",
    "description": {
      "en": "Precise Japanese art direction with delicate depth and interaction.",
      "zh": "精致的日系排版、空间层次和细腻的交互反馈。"
    }
  },
  {
    "id": "011",
    "name": "Locomotive",
    "slug": "locomotive",
    "url": "https://locomotive.ca/",
    "category": "Scroll",
    "technologies": [
      "GSAP",
      "Canvas"
    ],
    "interactions": [
      "Scroll"
    ],
    "hasSound": false,
    "mobileFriendly": true,
    "aiAssisted": false,
    "status": "published",
    "description": {
      "en": "Inertial scrolling, oversized type and transitions that behave like camera cuts.",
      "zh": "惯性滚动、巨型字体和镜头式页面衔接。"
    }
  },
  {
    "id": "012",
    "name": "Make Me Pulse",
    "slug": "make-me-pulse",
    "url": "https://makemepulse.com/",
    "category": "Experimental",
    "technologies": [
      "WebGL",
      "GLSL"
    ],
    "interactions": [
      "Mouse",
      "Sound"
    ],
    "hasSound": true,
    "mobileFriendly": true,
    "aiAssisted": false,
    "status": "published",
    "description": {
      "en": "Breathing organic forms, sound and playful experimental interaction.",
      "zh": "具有呼吸感的有机图形、声音和实验性互动。"
    }
  },
  {
    "id": "013",
    "name": "Cuberto",
    "slug": "cuberto",
    "url": "https://cuberto.com/",
    "category": "Mouse",
    "technologies": [
      "GSAP",
      "Canvas"
    ],
    "interactions": [
      "Mouse",
      "Scroll"
    ],
    "hasSound": false,
    "mobileFriendly": true,
    "aiAssisted": false,
    "status": "published",
    "description": {
      "en": "Magnetic buttons, cursor following and exceptionally smooth transitions.",
      "zh": "鼠标跟随、磁吸按钮和丝滑的页面过渡。"
    }
  },
  {
    "id": "014",
    "name": "Studio Freight",
    "slug": "studio-freight",
    "url": "https://studiofreight.com/",
    "category": "Scroll",
    "technologies": [
      "GSAP",
      "Canvas"
    ],
    "interactions": [
      "Mouse",
      "Scroll"
    ],
    "hasSound": false,
    "mobileFriendly": true,
    "aiAssisted": false,
    "status": "published",
    "description": {
      "en": "Bold typography animated with weight, inertia and physical movement.",
      "zh": "强排版与带有重量感的惯性和物理动画。"
    }
  },
  {
    "id": "015",
    "name": "OBYS",
    "slug": "obys",
    "url": "https://obys.agency/",
    "category": "Scroll",
    "technologies": [
      "GSAP",
      "WebGL"
    ],
    "interactions": [
      "Mouse",
      "Scroll"
    ],
    "hasSound": false,
    "mobileFriendly": true,
    "aiAssisted": false,
    "status": "published",
    "description": {
      "en": "Editorial typography and cinematic scroll choreography.",
      "zh": "先锋字体、编辑设计和电影般的滚动转场。"
    }
  },
  {
    "id": "016",
    "name": "Akaru",
    "slug": "akaru",
    "url": "https://akaru.fr/",
    "category": "Experimental",
    "technologies": [
      "WebGL",
      "GSAP"
    ],
    "interactions": [
      "Mouse",
      "Scroll"
    ],
    "hasSound": false,
    "mobileFriendly": true,
    "aiAssisted": false,
    "status": "published",
    "description": {
      "en": "French art direction expressed through rhythmic experimental motion.",
      "zh": "法式艺术指导与富有节奏的实验动画。"
    }
  },
  {
    "id": "017",
    "name": "Aristide Benoist",
    "slug": "aristide-benoist",
    "url": "https://aristidebenoist.com/",
    "category": "Scroll",
    "technologies": [
      "WebGL",
      "GSAP"
    ],
    "interactions": [
      "Mouse",
      "Scroll"
    ],
    "hasSound": false,
    "mobileFriendly": true,
    "aiAssisted": false,
    "status": "published",
    "description": {
      "en": "Minimal compositions with meticulously timed scroll animation.",
      "zh": "极简构图和精确到帧的滚动动画编排。"
    }
  },
  {
    "id": "018",
    "name": "Hello Monday",
    "slug": "hello-monday",
    "url": "https://hellomonday.com/",
    "category": "Game",
    "technologies": [
      "Canvas",
      "WebGL"
    ],
    "interactions": [
      "Mouse",
      "Sound"
    ],
    "hasSound": true,
    "mobileFriendly": true,
    "aiAssisted": false,
    "status": "published",
    "description": {
      "en": "Brand stories transformed through illustration, play and interaction.",
      "zh": "把插画、故事和游戏机制融合进品牌网页。"
    }
  },
  {
    "id": "019",
    "name": "Monopo London",
    "slug": "monopo-london",
    "url": "https://monopo.london/",
    "category": "Mouse",
    "technologies": [
      "GSAP",
      "Canvas"
    ],
    "interactions": [
      "Mouse",
      "Scroll"
    ],
    "hasSound": false,
    "mobileFriendly": true,
    "aiAssisted": false,
    "status": "published",
    "description": {
      "en": "Bold color, editorial layouts and responsive pointer effects.",
      "zh": "大胆色彩、杂志排版和灵敏的指针反馈。"
    }
  },
  {
    "id": "020",
    "name": "Rally Interactive",
    "slug": "rally-interactive",
    "url": "https://rallyinteractive.com/",
    "category": "3D World",
    "technologies": [
      "WebGL",
      "Canvas"
    ],
    "interactions": [
      "Mouse",
      "Scroll"
    ],
    "hasSound": true,